university_name,country,region,course_title,course_level,primary_language,secondary_language,course_url,year_verified,subject_area,teaching_style
Stanford University,USA,North America,CS 194A Android Workshop,Intermediate,Kotlin,Java,https://cs194a.stanford.edu,2026,Android Development,Project-based
University of Helsinki,Finland,Europe,Kotlin Programming (MOOC),Beginner,Kotlin,None,https://mooc.fi/en/courses/kotlin/,2026,Programming Fundamentals,Lecture + Exercises
Indian Institute of Technology Bombay,India,Asia,Android App Development (Kotlin),Advanced,Kotlin,Java,https://www.iitb.ac.in,2026,Android Development,Project-based
Indian Institute of Technology Delhi,India,Asia,Mobile Computing (Kotlin usage),Advanced,Kotlin,Java,https://home.iitd.ac.in,2026,Android Development,Lecture + Project
Parul University,India,Asia,Android Development using Kotlin,Intermediate,Kotlin,Java,https://paruluniversity.ac.in,2026,Android Development,Project-based
MIT,USA,North America,Mobile Application Development (Android + Kotlin),Advanced,Kotlin,Java,https://ocw.mit.edu,2026,Android Development,Project-based
University of Cambridge,UK,Europe,Mobile Systems Programming (Kotlin modules),Intermediate,Kotlin,Java,https://www.cl.cam.ac.uk,2026,Android Development,Lecture + Project